{
  "$schema": "../../../schemas/conformance-case.schema.json",
  "id": "tools.snap_to_peak.configurable_window_large",
  "specification_id": "tools.snap_to_peak",
  "description": "With a larger search window, snap to a farther but larger maximum.",
  "inputs": [
    {
      "id": "ecg",
      "value": [
        0,
        1,
        4,
        1,
        0,
        3,
        0
      ]
    },
    {
      "id": "detections",
      "value": [
        5
      ]
    }
  ],
  "parameters": {
    "window_size": 3
  },
  "expected_outputs": [
    {
      "id": "refined_detections",
      "fixture_id": "tools.synthetic.snap_to_peak_cases",
      "file_role": "window_case_table",
      "column": "refined_window_large",
      "absolute_tolerance": 0
    }
  ],
  "nan_equal": true,
  "oracle": {
    "type": "biosigmat",
    "description": "Expected detection generated by Biosigmat snaptopeak with WindowSize = 3.",
    "commit": "04365c8ac02c886c4839412a319cac60221ab1ef"
  }
}
