{
  "$schema": "../../../schemas/conformance-case.schema.json",
  "id": "tools.nan_filter.short_segments_unfiltered_001",
  "specification_id": "tools.nan_filter",
  "description": "Segments shorter than the coefficient-vector length are returned after interpolation rather than filtered.",
  "inputs": [
    {
      "id": "numerator_coefficients",
      "value": [
        0.5,
        0.5
      ]
    },
    {
      "id": "denominator_coefficients",
      "value": [
        1
      ]
    },
    {
      "id": "signal",
      "fixture_id": "tools.synthetic.nan_filtering_cases",
      "file_role": "short_segments_case_table",
      "column": "x_short_segments"
    }
  ],
  "parameters": {
    "max_gap": 1
  },
  "expected_outputs": [
    {
      "id": "filtered_signal",
      "fixture_id": "tools.synthetic.nan_filtering_cases",
      "file_role": "short_segments_case_table",
      "column": "nan_filter_short_segments",
      "absolute_tolerance": 0
    }
  ],
  "nan_equal": true,
  "oracle": {
    "type": "biosigmat",
    "description": "Expected output generated by Biosigmat nanfilter for valid segments of length one separated by a long NaN gap.",
    "commit": "04365c8ac02c886c4839412a319cac60221ab1ef"
  }
}
