{
  "$schema": "../../../schemas/conformance-case.schema.json",
  "id": "hrv.tdmetrics.synthetic_mixed_001",
  "specification_id": "hrv.tdmetrics",
  "description": "Synthetic mixed NN interval sequence for hrv.tdmetrics with one NaN gap and valid successive differences of approximately 0.02, 0.08, 0.04, and 0.07 seconds.",
  "inputs": [
    {
      "id": "nn_intervals",
      "fixture_id": "hrv.tdmetrics.synthetic_mixed_001",
      "file_role": "nn_intervals",
      "column": "nn_interval_s"
    }
  ],
  "parameters": {},
  "expected_outputs": [
    {
      "id": "mhr",
      "value": 70.17543859649123,
      "absolute_tolerance": 1e-10
    },
    {
      "id": "sdnn",
      "value": 70.92249290598856,
      "absolute_tolerance": 1e-10
    },
    {
      "id": "sdsd",
      "value": 27.53785273643052,
      "absolute_tolerance": 1e-10
    },
    {
      "id": "rmssd",
      "value": 57.662812973353944,
      "absolute_tolerance": 1e-10
    },
    {
      "id": "pnn50",
      "value": 50.0,
      "absolute_tolerance": 1e-10
    }
  ],
  "nan_equal": true,
  "oracle": {
    "type": "analytical",
    "description": "Expected values are calculated directly from the normative definitions in the specification and independently checked against the current Biosigmat behavior."
  }
}
