{
  "$schema": "../../../schemas/conformance-case.schema.json",
  "id": "tools.snap_to_peak.local_maxima",
  "specification_id": "tools.snap_to_peak",
  "description": "Snap approximate detections to clear local maxima within a two-sample search window.",
  "inputs": [
    {
      "id": "ecg",
      "value": [
        0,
        1,
        3,
        1,
        0,
        0,
        2,
        5,
        2,
        0
      ]
    },
    {
      "id": "detections",
      "value": [
        2,
        7
      ]
    }
  ],
  "parameters": {
    "window_size": 2
  },
  "expected_outputs": [
    {
      "id": "refined_detections",
      "fixture_id": "tools.synthetic.snap_to_peak_cases",
      "file_role": "case_table",
      "column": "refined_local",
      "absolute_tolerance": 0
    }
  ],
  "nan_equal": true,
  "oracle": {
    "type": "biosigmat",
    "description": "Expected detections generated by Biosigmat snaptopeak for two local maxima.",
    "commit": "04365c8ac02c886c4839412a319cac60221ab1ef"
  }
}
