{
  "$schema": "../../../schemas/conformance-case.schema.json",
  "id": "ecg.pantompkins.medicom_mtd_r_wave_times",
  "specification_id": "ecg.pantompkins",
  "description": "Detect R-wave occurrence times from the shared ECG signal using the default Pan-Tompkins-style parameters.",
  "inputs": [
    {
      "id": "ecg",
      "fixture_id": "ecg.medicom_mtd.ecg_respiration",
      "file_role": "signal_table",
      "column": "ecg"
    },
    {
      "id": "sampling_frequency",
      "value": 256
    }
  ],
  "parameters": {},
  "expected_outputs": [
    {
      "id": "r_wave_times",
      "fixture_id": "ecg.medicom_mtd.r_wave_timing",
      "file_role": "beat_timing_table",
      "column": "r_wave_times",
      "absolute_tolerance": 0
    }
  ],
  "nan_equal": true,
  "oracle": {
    "type": "biosigmat",
    "description": "Expected R-wave times were generated by the Biosigmat pantompkins implementation and recorded in its regression fixture by the cited commit.",
    "commit": "598937af920aba8ba0605dad56b1e050d91147cd"
  }
}
