{
  "$schema": "../../../schemas/conformance-case.schema.json",
  "id": "hrv.osp.halfway_rounding_alignment",
  "specification_id": "hrv.osp",
  "description": "Use the fewer-than-three-band-samples branch and verify positive half-way delay rounding, first retained sample, and output length.",
  "inputs": [
    {
      "id": "m",
      "value": [0, 1, 2, 3, 4, 5]
    },
    {
      "id": "resp",
      "value": [1, 0, 0, 0, 0, 0]
    },
    {
      "id": "resp_pxx",
      "value": [0, 0, 1, 0, 0]
    },
    {
      "id": "f",
      "value": [0, 0.2, 0.4, 0.6, 0.8]
    },
    {
      "id": "fs",
      "value": 0.5
    }
  ],
  "parameters": {},
  "expected_outputs": [
    {
      "id": "m_resp",
      "value": [2, 0, 0, 0],
      "absolute_tolerance": 1e-10
    },
    {
      "id": "m_unrelated",
      "value": [0, 3, 4, 5],
      "absolute_tolerance": 1e-10
    },
    {
      "id": "delay",
      "value": 3,
      "absolute_tolerance": 0
    }
  ],
  "nan_equal": true,
  "oracle": {
    "type": "analytical",
    "description": "The isolated 0.4 Hz bin is the only occupied-band sample, so 2 * 0.5 / 0.4 = 2.5 rounds upward to delay 3. The outputs therefore correspond to m[2:] and contain four samples. With the impulse respiration, the rank-one subspace retains only the first delayed sample."
  }
}
