{
  "$schema": "../../../schemas/conformance-case.schema.json",
  "id": "tools.nan_filter.all_nan_input_001",
  "specification_id": "tools.nan_filter",
  "description": "Return all NaN with matching length for an all-NaN input signal.",
  "inputs": [
    {
      "id": "numerator_coefficients",
      "value": [
        0.5,
        0.5
      ]
    },
    {
      "id": "denominator_coefficients",
      "value": [
        1
      ]
    },
    {
      "id": "signal",
      "fixture_id": "tools.synthetic.nan_filtering_cases",
      "file_role": "all_nan_case_table",
      "column": "x_all_nan"
    }
  ],
  "parameters": {
    "max_gap": 1
  },
  "expected_outputs": [
    {
      "id": "filtered_signal",
      "fixture_id": "tools.synthetic.nan_filtering_cases",
      "file_role": "all_nan_case_table",
      "column": "nan_filter_all_nan",
      "absolute_tolerance": 0
    }
  ],
  "nan_equal": true,
  "oracle": {
    "type": "biosigmat",
    "description": "Expected output generated by Biosigmat nanfilter for all-NaN input.",
    "commit": "04365c8ac02c886c4839412a319cac60221ab1ef"
  }
}
