{
  "$schema": "../../../schemas/conformance-case.schema.json",
  "id": "hrv.fillgaps.over_insertion_fallback",
  "specification_id": "hrv.fillgaps",
  "description": "Keep the preceding one-insertion reconstruction when the two-insertion attempt makes every interval too short.",
  "inputs": [
    {
      "id": "tk",
      "value": [0, 0.4, 1.1, 2.4, 2.9, 3.55]
    }
  ],
  "parameters": {},
  "expected_outputs": [
    {
      "id": "tn",
      "value": [0, 0.4, 1.1, 1.8021604938271607, 2.4, 2.9, 3.55],
      "absolute_tolerance": 1e-12
    },
    {
      "id": "dtn",
      "value": [0.4, 0.7, 0.7021604938271605, 0.5978395061728395, 0.5, 0.65],
      "absolute_tolerance": 1e-12
    }
  ],
  "nan_equal": true,
  "oracle": {
    "type": "analytical",
    "description": "The gap baseline is 0.6 s, so the upper bound is 0.69 s and the lower bound is 0.5 s. The one-insertion intervals 0.7021604938271605 and 0.5978395061728395 s are not sufficient; all three two-insertion intervals are strictly below 0.5 s, so the preceding reconstruction is retained."
  }
}
