{
  "$schema": "../../../schemas/conformance-case.schema.json",
  "id": "tools.medfilt_threshold.row_vector_orientation",
  "specification_id": "tools.medfilt_threshold",
  "description": "Treat a row-vector input as the same ordered signal as the canonical column-vector case.",
  "inputs": [
    {
      "id": "x",
      "value": [
        [
          1,
          1,
          1,
          10,
          1,
          1,
          1
        ]
      ]
    }
  ],
  "parameters": {
    "window": 3,
    "factor": 2,
    "max_threshold": 5
  },
  "expected_outputs": [
    {
      "id": "threshold",
      "fixture_id": "tools.synthetic.medfilt_threshold_cases",
      "file_role": "case_table",
      "column": "threshold_normal",
      "absolute_tolerance": 0
    }
  ],
  "nan_equal": true,
  "oracle": {
    "type": "biosigmat",
    "description": "Biosigmat medfiltThreshold converts row and column vector inputs to the same internal column vector before processing.",
    "commit": "04365c8ac02c886c4839412a319cac60221ab1ef"
  }
}
