{
  "$schema": "../../../schemas/conformance-case.schema.json",
  "id": "tools.medfilt_threshold.odd_window_behavior",
  "specification_id": "tools.medfilt_threshold",
  "description": "Capture Biosigmat behavior for a requested odd window on the same signal used for the even-window case.",
  "inputs": [
    {
      "id": "x",
      "fixture_id": "tools.synthetic.medfilt_threshold_cases",
      "file_role": "case_table",
      "column": "x_odd_even"
    }
  ],
  "parameters": {
    "window": 5,
    "factor": 1,
    "max_threshold": 1000
  },
  "expected_outputs": [
    {
      "id": "threshold",
      "fixture_id": "tools.synthetic.medfilt_threshold_cases",
      "file_role": "case_table",
      "column": "threshold_window_5",
      "absolute_tolerance": 0
    }
  ],
  "nan_equal": true,
  "oracle": {
    "type": "biosigmat",
    "description": "Expected threshold generated by Biosigmat medfiltThreshold with requested window = 5.",
    "commit": "04365c8ac02c886c4839412a319cac60221ab1ef"
  }
}
