{
  "$schema": "../../../schemas/conformance-case.schema.json",
  "id": "tools.nan_filtfilt.short_nan_gap_interpolation_001",
  "specification_id": "tools.nan_filtfilt",
  "description": "Interpolate a short NaN gap before applying zero-phase filtering.",
  "inputs": [
    {
      "id": "numerator_coefficients",
      "value": [
        0.5,
        0.5
      ]
    },
    {
      "id": "denominator_coefficients",
      "value": [
        1
      ]
    },
    {
      "id": "signal",
      "fixture_id": "tools.synthetic.nan_filtering_cases",
      "file_role": "pulse_case_table",
      "column": "x_short_gap"
    }
  ],
  "parameters": {
    "max_gap": 1
  },
  "expected_outputs": [
    {
      "id": "filtered_signal",
      "fixture_id": "tools.synthetic.nan_filtering_cases",
      "file_role": "pulse_case_table",
      "column": "nan_filtfilt_short_gap",
      "absolute_tolerance": 0
    }
  ],
  "nan_equal": true,
  "oracle": {
    "type": "biosigmat",
    "description": "Expected output generated by Biosigmat nanfiltfilt for a one-sample NaN gap with maxgap = 1.",
    "commit": "04365c8ac02c886c4839412a319cac60221ab1ef"
  }
}
